{
  "schema_version": "1.0.0",
  "run_id": "run-01JQ8Z4K2M0000000000000001",
  "measurement_id": "msr-01JQ8Z4K2M0000000000000003",
  "metric_id": "META_DESCRIPTION",
  "source_url": "https://example.com/",
  "observed_at": "2026-09-06T09:12:48Z",
  "collector": "HTML_BASELINE",
  "collector_version": "1.0.0",
  "assessment": {
    "collection_mode": "MEASURED",
    "result_state": "UNKNOWN"
  }
}
