{
  "schema_version": "1.0.0",
  "run_id": "run-01JQ8Z4K2M0000000000000001",
  "measurement_id": "msr-01JQ8Z4K2M0000000000000005",
  "metric_id": "CANONICAL_URL",
  "source_url": "https://example.com/pricing",
  "observed_at": "2026-09-06T09:12:50Z",
  "collector": "HTML_BASELINE",
  "collector_version": "1.0.0",
  "assessment": {
    "not_assessed_reason": "TIMEOUT"
  }
}
